<?xml version="1.0" encoding="UTF-8"?>
<!DOCTYPE root SYSTEM "log.dtd">
<root>
    <date1>
        <user>doru'sfood@yahoo.com</user>
        <pass>654321</pass>    
    </date1> 
    <date1>
        <user>doru'sfood@yahoo.com</user>
        <pass>654321</pass>    
    </date1> 
    <date1>
        <user>doru'sfood@yahoo.com</user>
        <pass>654321</pass>    
    </date1> 
</root>
